{
  "language": "csharp",
  "slug": "attributes",
  "title": "Attributes",
  "docs": {
    "about": "# About\r\n\r\nA [C# `Attribute`][attribute-concept] provides a way to decorate a declaration to associate metadata to: a class, a method, an enum, a field, a property or any [other supported][attribute-targets] declarations.\r\n\r\nYou can apply [an attribute][attribute] to a declaration by adding it between brackets `[]` before the declaration, the following example uses both a `ClassAttribute` and a `FieldAttribute`:\r\n\r\n```csharp\r\n[Class]\r\npublic class MyClass\r\n{\r\n    [Field] public int myField;\r\n}\r\n```\r\n\r\nThe declarative metadata only associates additional structured information to the code and does not modify its behavior, but that metadata is used by other part of the code to change how its target would behave or add, change or remove, restrict some its functionalities.\r\n\r\nMultiple predefined attributes exist like: `Flags`, `Obsolete`, `Conditional`. Note that the full name of the [`Flags` attribute][flags-attribute] is `FlagsAttribute`, but \"Attribute\" suffix can be omitted when using in the attribute.\r\n\r\nThe following four predefined attributes are used regularly:\r\n\r\n- `[Flags]`: Predefined in the System namespace. Indicates the enum supports both bitwise operations and the method `Enum.HasFlag()`, additionally `ToString` would display all the flags: [see example][flags-example].\r\n- `[Obsolete]`: Predefined in the System namespace. Allows to add a message about why the code is obsolete, it can be used to display compiler warnings or errors.\r\n- `[Conditional]`: Predefined in the System.Diagnostics namespace. Allows to remove some method calls at compile time for debugging (diagnostics) purposes.\r\n- `[CallerMemberName]`: Predefined in the System.Runtime.CompilerServices namespace. Allows a method to obtain information about its caller.\r\n\r\n[attribute-concept]: https://docs.microsoft.com/en-us/dotnet/csharp/programming-guide/concepts/attributes/\r\n[attribute]: https://docs.microsoft.com/en-us/dotnet/csharp/tutorials/attributes\r\n[attribute-targets]: https://docs.microsoft.com/en-us/dotnet/csharp/programming-guide/concepts/attributes/#attribute-targets\r\n[flags-attribute]: https://docs.microsoft.com/en-us/dotnet/api/system.flagsattribute\r\n[flags-example]: https://docs.microsoft.com/en-us/dotnet/api/system.flagsattribute\r\n",
    "introduction": "# Introduction\r\n\r\nA [C# `Attribute`](https://docs.microsoft.com/en-us/dotnet/csharp/programming-guide/concepts/attributes/) provides a way to decorate a declaration to associate metadata to: a class, a method, an enum, a field, a property or any [other supported](https://docs.microsoft.com/en-us/dotnet/csharp/programming-guide/concepts/attributes/#attribute-targets) declarations.\r\n\r\nYou can apply an attribute by adding it on the line before the declaration using a `ClassAttribute` and a `FieldAttribute`:\r\n\r\n```csharp\r\n[Class]\r\nclass MyClass\r\n{\r\n    [Field]\r\n    int myField;\r\n}\r\n```\r\n\r\nThis declarative metadata only associates additional structured information to the code and does not modify its behavior, but that metadata is used by other part of the code to change how its target would behave or add, change or remove, restrict some its functionalities.\r\n\r\nThere are many [predefined and reserved attributes](https://docs.microsoft.com/en-us/dotnet/csharp/language-reference/attributes/general#conditional-attribute), for example: `Flags`, `Obsolete`, `Conditional`, each has a specific that can be looked up on the C# documentation. Note that the full name of an attribute like [`Flags`](https://docs.microsoft.com/en-us/dotnet/api/system.flagsattribute)\r\n"
  },
  "links": [
    {
      "url": "https://docs.microsoft.com/en-us/dotnet/csharp/programming-guide/concepts/attributes/",
      "description": "Attribute"
    },
    {
      "url": "https://docs.microsoft.com/en-us/dotnet/csharp/tutorials/attributes",
      "description": "Tutorial"
    },
    {
      "url": "https://docs.microsoft.com/en-us/dotnet/csharp/language-reference/attributes/global",
      "description": "Assembly level attributes"
    }
  ]
}