{
  "language": "csharp",
  "slug": "namespaces",
  "title": "Namespaces",
  "docs": {
    "about": "# About\r\n\r\nIt is unlikely that you will come across much production code that does not make use of namespaces.\r\n\r\nAn example of the syntax is:\r\n\r\n```csharp\r\nnamespace MyNameSpace\r\n{\r\n    public class MyClass {}\r\n\r\n    public class OtherClass {}\r\n}\r\n```\r\n\r\nNamespaces are a way to group related code and to avoid name clashes.\r\n\r\nAccording to the [official documentation][namespaces] namespaces have two principal roles:\r\n\r\n- First, .NET uses namespaces to organize its many classes\r\n- Second, declaring your own namespaces can help you control the scope of class and method names in larger programming projects.\r\n\r\nNamespaces are used widely by the base class library (BCL) to organize its functionality.\r\n\r\n## References to namespaced types\r\n\r\nTypes enclosed in namespaces are referred to outside the namespace by prefixing the type name with the dot syntax. Alternatively, and more usually, you can place a `using` directive at the top of the file (or within a namespace) and any types in the imported namespace can be used without the prefix. Within the same namespace there is no need to qualify type names.\r\n\r\n```csharp\r\nnamespace MySpace\r\n{\r\n    public class MyClass {}\r\n\r\n    public class Foo\r\n    {\r\n        public void Bar()\r\n        {\r\n            var baz = new MyClass();\r\n        }\r\n    }\r\n}\r\n\r\npublic class Qux\r\n{\r\n    public void Box()\r\n    {\r\n        var nux = new MySpace.MyClass();\r\n    }\r\n}\r\n\r\nnamespace OtherSpace\r\n{\r\n    using MySpace;\r\n\r\n    public class Tix\r\n    {\r\n        public void Jeg()\r\n        {\r\n            var lor = new MyClass();\r\n        }\r\n    }\r\n}\r\n```\r\n\r\nThis [article][using] clearly explains the ways in which the `using` directive can be used:\r\n\r\n- `using`: avoid having to qualify types with namespace\r\n- `using static`: avoid having to qualify members with types (a good example is `Math.Max()`).\r\n- `using MyAlias = YourNamespace;`: substitute a more readable name for the namespace name.\r\n\r\n## Clash of namespaces\r\n\r\n.NET addresses the issue of two namespaces with the same name in different assemblies where there would be a clash of fully qualified identifier names (perhaps a scenario where multiple versions of an assembly are loaded). This issue is addressed with the [namespace alias qualifier][namespace-alias-qualifier] and the [extern alias][extern-alias].\r\n\r\nOne reason to raise this fairly niche topic is because of its use of the [`::` operator][dot-dot-operator]. You will often see the qualifier `global::` prefixing namespaces, particularly in generated code. The intention here is to avoid a potential clash with some nested namespace or class name. By prefixing a namespace with `global::` you ensure that a top-level namespace is selected.\r\n\r\n## Note for Java developers\r\n\r\nWhen comparing with the `import` of Java `packages` some differences and similarities should be noted:\r\n\r\n- There is no equivalent with C# of importing specific types.\r\n- `using static` and `import static` are equivalent.\r\n- In Java, package names have an impact on accessibility as between jars. In C# assemblies are paramount and belonging to the same namespace does not affect access level.\r\n- The relationship between file system paths and fully qualified class names in Java is not reflected in C#'s namespaces although it is good practice where possible to give a file the same name as the principal class it contains.\r\n\r\n[namespaces]: https://docs.microsoft.com/en-us/dotnet/csharp/programming-guide/namespaces/\r\n[accessibility-levels]: https://docs.microsoft.com/en-us/dotnet/csharp/language-reference/keywords/accessibility-levels\r\n[namespace-alias-qualifier]: https://docs.microsoft.com/en-us/dotnet/csharp/language-reference/operators/namespace-alias-qualifier\r\n[extern-alias]: https://docs.microsoft.com/en-us/dotnet/csharp/language-reference/keywords/extern-alias\r\n[using]: https://docs.microsoft.com/en-us/dotnet/csharp/language-reference/keywords/using-directive\r\n[assemblies]: https://docs.microsoft.com/en-us/dotnet/standard/assembly/\r\n[dot-dot-operator]: https://docs.microsoft.com/en-us/dotnet/csharp/language-reference/operators/namespace-alias-qualifier\r\n",
    "introduction": "# Introduction\r\n\r\nNamespaces are a way to group related code and to avoid name clashes and are generally present in all but the most trivial code base.\r\n\r\nThe syntax is as follows:\r\n\r\n```csharp\r\nnamespace MyNameSpace\r\n{\r\n    public class MyClass {}\r\n\r\n    public class OtherClass {}\r\n}\r\n```\r\n\r\nTypes enclosed in namespaces are referred to outside the scope of the namespace by prefixing the type name with the dot syntax. Alternatively, and more usually, you can place a `using` directive at the top of the file (or within a namespace) and type can be used without the prefix. Within the same namespace there is no need to qualify type names.\r\n\r\n```csharp\r\nnamespace MySpace\r\n{\r\n    public class MyClass {}\r\n\r\n    public class Foo\r\n    {\r\n        public void Bar()\r\n        {\r\n            var baz = new MyClass();\r\n        }\r\n    }\r\n}\r\n\r\npublic class Qux\r\n{\r\n    public void Box()\r\n    {\r\n        var nux = new MySpace.MyClass();\r\n    }\r\n}\r\n\r\nnamespace OtherSpace\r\n{\r\n    using MySpace;\r\n\r\n    public class Tix\r\n    {\r\n        public void Jeg()\r\n        {\r\n            var lor = new MyClass();\r\n        }\r\n    }\r\n}\r\n```\r\n\r\nYou can alias a namespace with the syntax `using MyAlias = MySpace;` and then use the alias anywhere that the namespace could be used.\r\n"
  },
  "links": [
    {
      "url": "https://docs.microsoft.com/en-us/dotnet/csharp/programming-guide/namespaces/",
      "description": "namespaces"
    },
    {
      "url": "https://docs.microsoft.com/en-us/dotnet/csharp/language-reference/keywords/using-directive",
      "description": "using"
    },
    {
      "url": "https://docs.microsoft.com/en-us/dotnet/csharp/language-reference/operators/namespace-alias-qualifier",
      "description": "namespace-alias-qualifier"
    },
    {
      "url": "https://docs.microsoft.com/en-us/dotnet/csharp/language-reference/keywords/extern-alias",
      "description": "extern-alias"
    },
    {
      "url": "https://docs.microsoft.com/en-us/dotnet/csharp/language-reference/operators/namespace-alias-qualifier",
      "description": "dot-dot-operator"
    },
    {
      "url": "https://docs.microsoft.com/en-us/dotnet/csharp/language-reference/keywords/accessibility-levels",
      "description": "accessibility-levels"
    }
  ]
}